{
  "contract": "cd-model-agnosticism-observation-sequence/v1",
  "sequence_id": "ice-cream-3-1-3",
  "revision": 1,
  "prior_sequence": null,
  "case_ref": "synthetic://hmm/ice-cream",
  "model_set_id": "stanford-ice-cream-demonstration",
  "model_set_revision": 1,
  "model_set_digest": "ed4a21a5feaffa75c6ffc57a60a679e7da4b2ecc23eed59d47c5c2f7da97b77e",
  "encoder": {
    "encoder_id": "ice-cream-count-bucket",
    "encoder_version": "1.0.0",
    "encoder_digest": "9a954997f1985a7cfbae66bb96c23e6ff32958b93b2d3b067781ff2f77d5fc26"
  },
  "analysis_as_of": "2026-09-02T00:00:00Z",
  "ordering_rule": "event_time_ascending_then_observation_id/v1",
  "step_semantics": "one day per observation",
  "items": [
    {
      "observation_id": "day-1",
      "sequence_index": 0,
      "symbol_id": "3",
      "event_time": "2026-08-30T00:00:00Z",
      "known_at": "2026-08-30T00:00:00Z",
      "source_refs": [
        "fixture://ice-cream/day-1"
      ],
      "coding_basis": "supplied count was exactly 3",
      "coding_status": "observed",
      "dependence_refs": [],
      "supersedes": null
    },
    {
      "observation_id": "day-2",
      "sequence_index": 1,
      "symbol_id": "1",
      "event_time": "2026-08-31T00:00:00Z",
      "known_at": "2026-08-31T00:00:00Z",
      "source_refs": [
        "fixture://ice-cream/day-2"
      ],
      "coding_basis": "supplied count was exactly 1",
      "coding_status": "observed",
      "dependence_refs": [
        "observation://day-1"
      ],
      "supersedes": null
    },
    {
      "observation_id": "day-3",
      "sequence_index": 2,
      "symbol_id": "3",
      "event_time": "2026-09-01T00:00:00Z",
      "known_at": "2026-09-01T00:00:00Z",
      "source_refs": [
        "fixture://ice-cream/day-3"
      ],
      "coding_basis": "supplied count was exactly 3",
      "coding_status": "observed",
      "dependence_refs": [],
      "supersedes": null
    }
  ]
}
